{
  "projectName": "AI会议纪要助手",
  "painPoint": "每周上万场会议，纪要全靠人写，信息丢了没人管",
  "oneLineSolution": "AI自动参会、实时转录、智能生成结构化纪要，解放90%的记录工作量",
  "targetUser": {
    "name": "会议召集人",
    "description": "大型企业中层管理者，每周组织3-5场跨部门会议，既要主持讨论又要在会后花大量时间整理纪要并催办落实"
  },
  "problem": {
    "context": "集团2000+员工，每周约1200场正式会议产生纪要。纪要编写依赖人工，平均每场会议需要30-45分钟整理，关键决策和待办经常遗漏，跨部门跟踪更是无从谈起。",
    "pains": [
      {
        "data": "1200+",
        "unit": "场/周",
        "title": "纪要编写负担重",
        "detail": "每周1200+场会议需要人工整理纪要，按30分钟/场计算，每周消耗600+工时在低价值的文字整理上"
      },
      {
        "data": "35%",
        "unit": "待办遗漏率",
        "title": "关键信息丢失",
        "detail": "手工记录遗漏约35%的关键待办和决策点，导致后续执行偏差，需反复确认拉齐"
      },
      {
        "data": "72h",
        "unit": "平均响应延迟",
        "title": "跨部门跟踪断裂",
        "detail": "跨部门会议的纪要分发和待办跟踪平均延迟3天，严重影响决策到执行的转化效率"
      }
    ]
  },
  "solution": {
    "points": [
      {
        "title": "AI实时转录与理解",
        "desc": "接入主流会议平台（飞书、腾讯会议、钉钉），利用大模型实时转录语音并理解语义，自动区分发言人、识别关键议题"
      },
      {
        "title": "结构化纪要生成",
        "desc": "按企业标准模板自动生成结构化纪要：议题摘要、关键决策、待办事项（含责任人和截止时间）、风险提示，1分钟出稿"
      },
      {
        "title": "待办闭环跟踪",
        "desc": "纪要中的待办自动同步至企业OA/项目管理工具，到期自动提醒，形成「会议-纪要-待办-完成」的完整闭环"
      }
    ]
  },
  "differentiation": "市面上有讯飞听见、飞书妙记等转录工具，但只解决'听写'问题。我们的方案更进一步：理解语义、提取决策、生成结构化纪要、自动派发待办。不是转录工具，是会议智能助理。企业内部会议数据不出域，私有化部署确保数据安全。",
  "businessModel": "按企业账号订阅收费。基础版覆盖转录+纪要生成，专业版增加待办跟踪和数据分析看板。预计客单价8-15万/年，首批面向集团内部验证后再对外推广。",
  "tenYearTest": "会议是人类协作的基础场景，十年后不会消失，只会更多。而人工整理纪要是纯粹的体力劳动，AI替代是必然趋势。现在做，是因为大模型的语义理解能力刚好达到了'可用'的临界点。",
  "moat": "企业级私有化部署能力 + 行业定制纪要模板 + 内部会议语料持续优化模型。一旦企业将会议数据接入，替换成本极高。",
  "firstUsers": "先从集团内部3个高频会议部门试点（产研周会、经营分析会、项目管理会），用真实场景打磨产品。内部验证通过后，以标杆案例切入同行业企业客户。",
  "scale": {
    "users": "2000+员工",
    "efficiency": "90%时间节省",
    "savings": "150万/年"
  },
  "resourcesNeeded": "2名后端工程师、1名前端工程师、1名产品经理，初期预算20万（含云资源和API调用费用）",
  "mvpPlan": [
    {
      "phase": "核心功能",
      "desc": "实现飞书会议接入、实时转录、基础纪要生成"
    },
    {
      "phase": "结构化输出",
      "desc": "接入大模型，实现议题提取、决策识别、待办拆解"
    },
    {
      "phase": "闭环跟踪",
      "desc": "对接OA系统，自动派发待办、到期提醒、完成度统计"
    },
    {
      "phase": "试点推广",
      "desc": "3个部门试点运行，收集反馈迭代，准备全面推广"
    }
  ],
  "mvpTimeline": "8周内完成MVP上线，12周完成试点验证"
}
